,title,artist,album,album_image,BPM,Camelot,lyrics
272,Dangerous Animals,Arctic Monkeys,Humbug,https://i.scdn.co/image/ab67616d00004851f65d720a5d70dbb93e96d528,125,5B,"i 'm pinned down by the dark been fighting with my sheets and nearly crying in my sleep yes , i 'm battling that well told gripe the most frustrating type you should have racing stripes the way you keep me in pursuit you sharpen the heel of your boot and you press it in my chest and you make me wheeze then to my knees you do promote me i 'm pinned down by the dark animal she makes my head pirouette more than i would be willing to confess dangerous the light it fidgets through , the thoughts will soon revert to you about as bashful as a tribal dance the first and final chance and of course the audience of frighteners and fiends divided up into two teams when the acrobat fell off the beam she broke everyone 's heart . i 'm pinned down by the dark animal she makes my head pirouette more than i would be willing to confess dangerous dangerous the most unsuitable pet , it 's been long enough now so let 's make a mess lioness pinned down by the dark i 'm pinned down by the dark dangerous animal dangerous animal"
273,Secret Door,Arctic Monkeys,Humbug,https://i.scdn.co/image/ab67616d00004851f65d720a5d70dbb93e96d528,125,6A,"fools on parade cavort and carry on for waiting eyes that you would rather be beside than in front of but she 's never been the kind to be hollowed by the stares she swam out of tonight 's phantasm grabbed my hand and made it very clear there 's absolutely nothing for us here it 's a magnolia celebration to be attempted on a wednesday night it 's better than to get a reputation as a miserable little tyke at least that 's the conclusion she came to in this overture the secret door swings behind us she 's saying nothing she 's just giggling along her arms were folded most indignant not looking like she was soon to leave i had to squint in order to believe and then like a butler pushing on a bookshelf and unveiling the unexpected i , who was earlier reluctant , was suddenly embarrassed and corrected how could such a creature survive in such a habitat the secret door swings behind us she 's saying nothing she 's just giggling along and even if they were to find us i would n't notice , i 'm completely occupied as all the fools on parade cavort and carry on for waiting eyes ones you would rather be beside than in front of but she 's never been the kind to be hollowed by the stares fools on parade frolic and fuck about to make a gaze turn to a scribble on a page by a picture that holds her absence but you 're daft to think she 'd care fools on parade 3x conduct a singalong"
274,Potion Approaching,Arctic Monkeys,Humbug,https://i.scdn.co/image/ab67616d00004851f65d720a5d70dbb93e96d528,104,9A,i was biting the time zone and we embellished the banks of our bloodstreams and threw caution to the colourful then we fell asleep in the car until the bumps woke me up in your grip and the tide took me to your mouth and then swept me back down to your palms it 's them that put me inside the reminder that yours is the only ocean yours is the only ocean that i want to swing from yours is the only ocean that i want to hang on i 've got this ego mechanic she 's always trying to give me vitamins oh she 'd be frightened of your reflection i preferred her as a cartoon if i could be someone else for a week i 'd still spend it chasing after you cos she 's not shattering my attitude no matter how she folds the potion yours is the only ocean that i want to swing from yours is the only ocean that i want to hang on to i 'm swinging on yours is the only ocean yours is the only ocean yours is the only ocean yours is the only ocean potion approaching shield your eyes potion approaching visualize holding a token swollen in size potion approaching shield your eyes oh but if we 're going to escape though we really ought to think it through would you like me to build you a go kart
275,Fire And The Thud,Arctic Monkeys,Humbug,https://i.scdn.co/image/ab67616d00004851f65d720a5d70dbb93e96d528,115,10B,"you showed me my tomorrow beside a box of matches a welcome threatening stir my hopes of being stolen might just ring true depends who you prefer but if it 's true you 're gon na run away tell me where , i 'll meet you there am i snapping the excitement if i pack away the laughter , and tell you how it feels and does burden come to meet you if i 've questions of the feature that rolls on your dream reel the day after you stole my heart everything i touched told me it would be better shared with you , with you and now you 're hiding in my soup and this book reveals your face and you 're splashing in my eyelids the concentration continually breaks i did request the mark you cast did n't heal as fast i hear your voice in silences will the teasing of the fire be followed by the thud in the jostling crowd you 're not allowed to tell the truth and the photo booth 's a liar there 's a sharpened explanation but there 's no screaming reason to enquire i 'd like to poke them in their prying eyes with things they 'd never see if it smacked them in their temples"
276,Cornerstone,Arctic Monkeys,Humbug,https://i.scdn.co/image/ab67616d00004851f65d720a5d70dbb93e96d528,169,11B,"i thought i saw you in the battleship but it was only a look alike she was nothing but a vision trick under the warning light she was close , close enough to be your ghost but my chances turned to toast when i asked her if i could call her your name i thought i saw you in the rusty hook , huddled up in a wicker chair i wandered over for a closer look and kissed whoever was sitting there she was close and she held me very tightly until i asked awfully politely '' please , can i call you her name '' and i elongated my lift home yeah i let him go the long way round i smelt your scent on the seat belt and kept my short cuts to myself i thought i saw you in the parrot 's beak messing with the smoke alarm it was too loud for me to hear her speak and she had a broken arm it was close , so close that the walls were wet and she wrote it out in letraset '' no , you ca n't call me her name '' tell me where 's your hiding place i 'm worried i 'll forget your face and i 've asked everyone i 'm beginning to think i imagined you all along i elongated my lift home yeah i let him go the long way round i smelt your scent on the seat belt and kept my short cuts to myself i saw your sister in the cornerstone on the phone to the middle man when i saw that she was on her own i thought she might understand she was close , well you could n't get much closer she said , i 'm really not supposed to , but , yes , you can call me anything you want ''"
277,Dance Little Liar,Arctic Monkeys,Humbug,https://i.scdn.co/image/ab67616d00004851f65d720a5d70dbb93e96d528,100,12A,"i heard the truth was built to bend a mechanism to suspend the guilt is what you will require and still you 've got to dance little liar it 's just like those fibs to pop and fizz and you 'll be forced to take that awful quiz and you 're bound to trip and she 'll detect the fiction on your lips and dig a contradiction up and the clean coming will hurt and you can never get it spotless when there 's dirt beneath the dirt the liar takes a lot less time i 'm sure it 's clear and plain to read it 's not an alibi you need just yet oh no , it 's something for those beads of sweat yes that will get you back to normal and after you have dabbed the patch you 'll breathe and then proceed to scratch the varnish off that newly added calmness so as not to raise any alarms too soon and the clean coming will hurt and you can never get it spotless when there 's dirt beneath the dirt the liar takes a lot less time to decide on the saunter have you got itchy bones and in all your time alone can you hack your mind being riddled with the wrong memories and the clean coming will hurt and you can never get it spotless when there 's dirt in between the dirt"
278,Pretty Visitors,Arctic Monkeys,Humbug,https://i.scdn.co/image/ab67616d00004851f65d720a5d70dbb93e96d528,83,11A,"trudging through the morning and the tramp with the trampoline under his arm , shifts past your whiskers so stark is the charm but the barking alarm waits coiled 'til the corner is turned and the bicycle wheels all struggle to move round in your muddy mind blatantly caked and unwilling to wind uncooperative time so he sits on the springs 'til the muck goes dry all the pretty visitors came and waved their arms and cast the shadow of a snake pit on the wall all the pretty visitors came and waved their arms and cast the shadow of a snake pit on the what came first the chicken or the dickhead split sleep reaps rewards from ill fitting thoughts and twilight forced you to go on a walk , your legs start running and your head gets caught canopy 19 is perfectly placed for the reasonably frightening fall from the aftertaste you 'll have to slip away i am unhappy to say , behold there 's a crook in the hammock plays all the pretty visitors came and waved their arms and cast the shadow of a snake pit on the wall all the pretty visitors came and waved their arms and cast the shadow of a snake pit on the wall behold there 's a crook in the hammock plays cruelly with the base of the scales and fiddles with the feet on a balancing act gagged , bound and crafting a tale trailing wrapped in a gasp cruelly with the base and the scales and fucking fiddles with the feet on a balancing act she was gagged , bound and crafting a tale trailing wrapped in a gasp all the pretty visitors came and waved their arms and cast the shadow of a snake pit on the wall all the pretty visitors came and waved their arms and cast the shadow of a snake pit on the wall"
279,The Jeweller's Hands,Arctic Monkeys,Humbug,https://i.scdn.co/image/ab67616d00004851f65d720a5d70dbb93e96d528,97,5A,"fiendish wonder in the carnival 's wake dull caresses once again irritate tread softly stranger move over toward the danger that you seek you think excitement has receded then the mirror distracts the logic of the trance quickly reaches and grasps handsome and faceless and weightless your imagination runs and now it 's no ones fault but yours at the foot of the house of cards you thought you 'd never get obsessed you thought the wolves would be impressed and you 're a sinking stone but you know what it 's like to hold the jeweller 's hands that procession of pioneers all drowned in the moonlight they 're more thrilling those things that he knows as he leads you through the grinning bubble blowers in the snow watching his exit was like falling off the ferry in the night the inevitables gather to push you around any other voice makes such a punishing sound it became laughter 's assassin shortly after he showed you what it was and now it 's no ones fault but yours , at the foot of the house of cards you thought you 'd never get obsessed you thought the wolves would be impressed and you 're a sinking stone but you know what it 's like to hold the jeweller 's hands that procession of pioneers all drowned if you 've a lesson to teach me i 'm listening , ready to learn there 's no one here to police me i 'm sinking in until the return if you 've a lesson to teach please do n't deviate , do n't be afraid without the last corner piece i ca n't calibrate , let 's get it engraved if you 've a lesson to teach me i 'm listening , ready to learn there 's no one here to police me i 'm sinking in until the return if you 've a lesson to teach please do n't deviate , do n't be afraid without the last corner piece i ca n't calibrate , let 's get it engraved if you 've a lesson to teach me i 'm listening , ready to learn there 's no one here to police me i 'm sinking in until the return if you 've a lesson to teach please do n't deviate , do n't be afraid without the last corner piece i ca n't calibrate , let 's get it engraved"
280,She's Thunderstorms,Arctic Monkeys,Suck It and See,https://i.scdn.co/image/ab67616d00004851cb44038b22f3d8a5e4e62d5a,119,9B,she 's thunderstorms lying on her front up against the wall she 's thunderstorms i 've been feeling foolish you should try it she came and substituted the peace and quiet for acrobatic blood flow concertina cheating heart beat rapid fire she 's thunderstorms lying on her front up against the wall she 's thunderstorms here is your host sounds as if she 's pretty close when the heat starts growing horns she 's thunderstorms she 's been loop the looping around my mind her motorcycle boots give me this kind of acrobatic blood concertina cheating heart beat rapid fire she 's thunderstorms lying on her front up against the wall she 's thunderstorms in an unusual place when you 're feeling far away she does what the night does to the day she 's thunderstorms lying on her front up against the wall she 's thunderstorms thunderstorms thunderstorms
281,Black Treacle,Arctic Monkeys,Suck It and See,https://i.scdn.co/image/ab67616d00004851cb44038b22f3d8a5e4e62d5a,100,9B,"lately i 've been seeing things belly button piercings in the sky at night when we 're side by side and i do n't mean to rain on anybody 's cabriolet one of those games you 're gon na lose but you wan na play it just in case now it 's getting dark and the sky looks sticky more like black treacle than tar black treacle somebody told the stars you 're not coming out tonight and so they found a place to hide does it help you stay up late does it help you concentrate does it tune you in when you chew your chin am i ruining your fun and you talk the talk alright but do you walk the walk or catch the train you wanted it , you got it but you do n't want it now now it 's getting dark and the sky looks sticky more like black treacle than tar black treacle somebody told the stars you 're not coming out tonight and so they found a place to hide and now i 'm out of place and i 'm not getting any wiser i feel like the sundance kid behind the synthesiser and i tried last night to pack away a laugh like a key under the mat but it never seems to be there when you want it black treacle black treacle black treacle"
282,Brick By Brick,Arctic Monkeys,Suck It and See,https://i.scdn.co/image/ab67616d00004851cb44038b22f3d8a5e4e62d5a,132,10B,"i wan na build you up brick by brick i wan na break you down brick by brick i 'm gon na reconstruct brick by brick i wan na feel your love brick by brick ahhhhhh brick by brick ahhhhhh i wan na steal your soul brick by brick i wan na rock and roll brick by brick i wan na rock and roll brick by brick i wan na rock and roll brick by brick ahhhhhh brick by brick ahhhhhh i want a brick by brick brick by brick i want a blow by blow brick by brick i want an episode brick by brick i want a brick by brick , by brick , by brick by brick ahhhhhh brick by brick ahhhhhh brick by brick ahhhhhh brick by brick ahhhhhh"
283,The Hellcat Spangled Shalalala,Arctic Monkeys,Suck It and See,https://i.scdn.co/image/ab67616d00004851cb44038b22f3d8a5e4e62d5a,130,1B,just when things are getting complicated in the eye of the storm she flicks a red hot revelation off the tip of her tongue it does a dozen somersaults and leaves you supercharged makes me wan na blow the candles out just to see if you glow in the dark shalalala shalalala shalalala shalalala home sweet home home sweet home home sweet booby trap i took the batteries out my mysticism and put them in my thinking cap she 's got a telescopic hallelujah hanging up on the wall for when it gets too complicated in the eye of the storm shalalala shalalala shalalala shalalala and in a hellcatspangled cavern when your judgment 's on the run and you 're acting like a stranger 'cause you thought it looked like fun and did you ever get the feeling that these are things she 's said before her steady hands may well have done the devil 's pedicure what you waiting for sing another fucking shalalala shalalala shalalala shalalala
284,Don't Sit Down 'Cause I've Moved Your Chair,Arctic Monkeys,Suck It and See,https://i.scdn.co/image/ab67616d00004851cb44038b22f3d8a5e4e62d5a,120,11B,break a mirror roll the dice run with scissors through a chip pan fire fight go into business with a grizzly bear but just do n't sit down 'cause i 've moved your chair find a well known hard man and start a fight wear your shellsuit on bonfire night fill in a circular hole with a peg that 's square but just do n't sit down 'cause i 've moved your chair ooh ... yeah yeah yeah x2 bite the lightning and tell me how it tastes kung fu fighting on your rollerskates do the macarena in the devil 's lair but just do n't sit down 'cause i 've moved your chair ooh ... yeah yeah yeah x3
285,Library Pictures,Arctic Monkeys,Suck It and See,https://i.scdn.co/image/ab67616d00004851cb44038b22f3d8a5e4e62d5a,97,3B,"i 'm in a vest library pictures of the quickening canoe the first of its kind to get to the moon trust some ellipses to chase you round the room through curly straws and metaphors and goo been watching all the neon blossom flickering you look as if you 've all forgotten where you 've been we 're going riding through the thunder suckle fuzz canyon 10 , 9 , 8 , 7 , 6 , 5 , 4 , 3 , 2 , 1 library pictures of the quickening canoe the first of it 's kind to get to the moon give me an eanie , meanie minie mo or an ip , dip , dog shit rock and roll"
286,All My Own Stunts,Arctic Monkeys,Suck It and See,https://i.scdn.co/image/ab67616d00004851cb44038b22f3d8a5e4e62d5a,127,10B,"caricatures of your wrecking ball gown in my mind all the time i wan na be in that damsel patterned alley where you go for a smoke and sorrow slow dances the phones are lighting up taking no chances close but never close enough been watching cowboy films on gloomy afternoons tinting the solitude put on your dancing shoes and show me what to do i know you 've got the moves all my own stunts high noon has changed its tune linking arms , sinking hearts and sorrow slow dances around the edges of her eyes taking no chances the last one out to win a prize been watching cowboy films on gloomy afternoons tinting the solitude put on your dancing shoes and show me what to do i know you 've got the moves 'cause i 'm from high green i 'm from high green"
287,Reckless Serenade,Arctic Monkeys,Suck It and See,https://i.scdn.co/image/ab67616d00004851cb44038b22f3d8a5e4e62d5a,128,10B,"topless models doing semaphore wave their flags as she walks by and get ignored illuminations on a rainy day when she walks , her footsteps sing a reckless serenade i 've been trying to figure out exactly what it is i need called up to listen to the voice of reason and got the answering machine the type of kisses where teeth collide when she laughs , the heavens hum a stungun lullaby those twinkling vixens with the shining spiral eyes their hypnosis goes unnoticed when she 's walking by i 've been trying to figure out exactly what it is i need called up to listen to the voice of reason and got his answering machine i left my message , but did he fuck get back to me and now i 'm stuck , still wondering how it 's meant to be singing a reckless serenade , reckless serenade reckless serenade , reckless serenade reckless serenade , reckless serenade reckless serenade"
288,Piledriver Waltz,Arctic Monkeys,Suck It and See,https://i.scdn.co/image/ab67616d00004851cb44038b22f3d8a5e4e62d5a,110,12B,"i etched a face of a stopwatch on the back of a raindrop and did a swap for the sand in an hourglass i heard an unhappy ending it sort of sounds like you leaving i heard the piledriver waltz it woke me up this morning you look like you 've been for breakfast at the heartbreak hotel and sat in the back booth by the pamphlets and the literature on how to lose your waitress was miserable and so was your food if you 're gon na try and walk on water make sure you wear your comfortable shoes mysteries flashing amber go green when you answer but the red on the rest of the questionnaire never changes i heard the news that you 're planning to shoot me out of a cannon i heard the piledriver waltz it woke me up this morning you look like you 've been for breakfast at the heartbreak hotel and sat in the back booth by the pamphlets and the literature on how to lose your waitress was miserable and so was your food if you 're gon na try and walk on water make sure you wear your comfortable shoes ohh , piledriver"
289,Love is a Laserquest,Arctic Monkeys,Suck It and See,https://i.scdn.co/image/ab67616d00004851cb44038b22f3d8a5e4e62d5a,170,1B,do you still feel younger than you thought you would by now or darling have you started feeling old yet do n't worry i 'm sure that you 're still breaking hearts with the efficiency that only youth can harness and do you still think love is a laserquest or do you take it all more seriously i 've tried to ask you this in some daydreams that i 've had but you 're always busy being make believe and do you look into the mirror to remind yourself you 're there or have somebody 's goodnight kisses got that covered when i 'm not being honest i pretend that you were just some lover now i ca n't think of there without thinking of you i doubt that comes as a surprise and i ca n't think of anything to dream about i ca n't find anywhere to hide and when i 'm hanging on by the rings around my eyes and i convince myself i need another for a minute it gets easier to pretend that you were just some lover when i 'm pipe and slippers and rocking chair singing dreadful songs about summer will i 've found a better method of pretending you were just some lover will i 've found a better method of pretending you were just some lover
290,Suck It and See,Arctic Monkeys,Suck It and See,https://i.scdn.co/image/ab67616d00004851cb44038b22f3d8a5e4e62d5a,128,12B,"your love is like a studded leather headlock your kiss it could put creases in the rain you 're rarer than a can of dandelion and burdock and those other girls are just postmix lemonade suck it and see you never know sit next to me before i go jigsaw women with horror movie shoes be cruel to me cause i 'm a fool for you i poured my aching heart into a pop song i could n't get the hang of poetry that 's not a skirt girl that 's a sawn off shotgun and i can only hope you 've got it aimed at me suck it and see you never know sit next to me before i go jigsaw women with horror movie shoes be cruel to me cause i 'm a fool for you blue moon girls from once upon a shangrila how i often wonder where you are you have got that face that just says '' baby , i was made to break your heart '' suck it and see , you never know sit next to me before i go go , go , go jigsaw women with horror movie shoes be cruel to me cause i 'm a fool for you"
291,That's Where You're Wrong,Arctic Monkeys,Suck It and See,https://i.scdn.co/image/ab67616d00004851cb44038b22f3d8a5e4e62d5a,136,12B,a pussyfooting setting sun make a wish that weighs a tonne there are no handles for you to hold and no understanding where it goes jealousy in technicolor fear by name than love by numbers street lamp amber wanderlust powder in a blunderbuss she looks as if she 's blowing a kiss at me and suddenly the sky is a scissor sitting on the floor with a tambourine crushing up a bundle of love do n't take it so personally you 're not the only one that time 's got it in for honey that 's where you 're wrong all the old flames fastened on make a wish that weighs a tonne there are no handles that you can hold and no understanding where it goes she looks as if she 's blowing a kiss at me and suddenly the sky is a scissor sitting on the floor with a tambourine crushing up a bundle of love do n't take it so personally you 're not the only one that time 's got it in for honey that 's where you 're wrong that 's where you 're wrong that 's where you 're wrong
292,West Hills - Abridged,The Killers,Pressure Machine (Abridged),https://i.scdn.co/image/ab67616d0000485130cfd1f4e913506fbe6960ac,170,5A,"i was born right here in zion , god 's own son his holy ghost stories and bloodshed never scared me none while they bowed their heads on sunday i cut out through the hedges and fields where the light could place its hands on my head in the west hills free in the west hills free in the west hills she 's got two fullgrown children , one still on the vine and once i got to know him i loved him like he was mine some nights we drive up the mouth of the canyon on hillbilly heroin pills we get out and watch the sunset peaceful and still and free in the west hills free in the west hills when the sheriff kicked my door down i was sleeping in my own bed and the mess i got caught up in rained hard down on my head they got me for possession of them hillbilly heroin pills enough to kill the horses that run free in the west hills they got me for possession of enough to kill the horses that run free in the west hills free in the west hills if this life was meant for proving i could use more years to live but fifteen in a guardhouse that 's more than i 'm willing to give and if there really is a judgement when he pulls my chart he 'll reject my actions but he will know my heart and he 'll prepare a place for me where happiness instills and the light puts its loving hands on my head free in the west hills they got me for possession of enough to kill the horses that run free in the west hills free in the west hills free , free in the west hills , in the west hills , in the west hills"
