,title,artist,album,album_image,BPM,Camelot,lyrics
0,Jenny Was A Friend Of Mine,The Killers,Hot Fuss,https://i.scdn.co/image/ab67616d000048519c284a6855f4945dc5a3cd73,114,1B,"we took a walk that night , but it was n't the same we had a fight on the promenade out in the rain she said she loved me , but she had somewhere to go she could n't scream while i held her close i swore i 'd never let her go tell me what you wan na know come on , come on there ai n't no motive for this crime jenny was a friend of mine come on , come on , yeah i know my rights , i 've been here all day and it 's time for me to go , so let me know if it 's alright i just ca n't take this , i swear i told you the truth she could n't scream while i held her close i swore i 'd never let her go tell me what you wan na know come on , come on there ai n't no motive for this crime jenny was a friend of mine then you whisper in my ear '' i know what you 're doing here '' come on , come on , yeah jenny was a friend of mine jenny was a friend of mine jenny was a friend of mine jenny was a friend of mine"
1,Mr. Brightside,The Killers,Hot Fuss,https://i.scdn.co/image/ab67616d000048519c284a6855f4945dc5a3cd73,148,3B,"coming out of my cage and i 've been doing just fine got ta , got ta be down , because i want it all it started out with a kiss , how did it end up like this it was only a kiss , it was only a kiss now i 'm falling asleep and she 's calling a cab while he 's having a smoke and she 's taking a drag now they 're going to bed and my stomach is sick and it 's all in my head , but she 's touching his chest now , he takes off her dress now , let me go and i just ca n't look , it 's killing me they 're taking control jealousy , turning saints into the sea swimming through sick lullabies , choking on your alibis but it 's just the price i pay , destiny is calling me open up my eager eyes , 'cause i 'm mr. brightside i 'm coming out of my cage and i 've been doing just fine got ta , got ta be down , because i want it all it started out with a kiss , how did it end up like this it was only a kiss , it was only a kiss now i 'm falling asleep and she 's calling a cab while he 's having a smoke and she 's taking a drag now they 're going to bed and my stomach is sick and it 's all in my head , but she 's touching his chest now , he takes off her dress now , let me go 'cause i just ca n't look , it 's killing me they 're taking control jealousy , turning saints into the sea swimming through sick lullabies , choking on your alibis but it 's just the price i pay , destiny is calling me open up my eager eyes , 'cause i 'm mr. brightside i never ... i never ... i never ... i never ..."
2,Smile Like You Mean It,The Killers,Hot Fuss,https://i.scdn.co/image/ab67616d000048519c284a6855f4945dc5a3cd73,125,2A,"save some face , you know you 've only got one change your ways while you 're young boy , one day you 'll be a man oh girl , he 'll help you understand smile like you mean it smile like you mean it looking back at sunsets on the eastside we lost track of the time dreams are n't what they used to be some things sat by so carelessly smile like you mean it smile like you mean it and someone is calling my name from the back of the restaurant and someone is playing a game in the house that i grew up in and someone will drive her around down the same streets that i did on the same streets that i did smile like you mean it smile like you mean it smile like you mean it smile like you mean it oh no , oh no , oh no no no oh no , oh no ..."
3,Somebody Told Me,The Killers,Hot Fuss,https://i.scdn.co/image/ab67616d000048519c284a6855f4945dc5a3cd73,138,3A,"breaking my back just to know your name seventeen tracks and i 've had it with this game i 'm breaking my back just to know your name but heaven ai n't close in a place like this anything goes but do n't blink , you might miss 'cause heaven ai n't close in a place like this i said , oh , heaven ai n't close in a place like this bring it back down , bring it back down tonight oohooh never thought i 'd let a rumor ruin my moonlight well , somebody told me you had a boyfriend who looked like a girlfriend that i had in february of last year it 's not confidential , i 've got potential ready let 's roll onto something new taking its toll then i 'm leaving without you 'cause heaven ai n't close in a place like this i said , oh , heaven ai n't close in a place like this bring it back down , bring it back down tonight oohooh never thought i 'd let a rumor ruin my moonlight well , somebody told me you had a boyfriend who looked like a girlfriend that i had in february of last year it 's not confidential , i 've got potential arushing , rushing around pace yourself for me i said maybe , baby , please but i just do n't know now maybe , baby when all i want to do is try well , somebody told me you had a boyfriend who looked like a girlfriend that i had in february of last year it 's not confidential , i 've got potential arushing , rushing around somebody told me you had a boyfriend who looked like a girlfriend that i had in february of last year it 's not confidential , i 've got potential arushing , rushing around somebody told me you had a boyfriend who looked like a girlfriend that i had in february of last year it 's not confidential , i 've got potential arushing , rushing around"
4,All These Things That I've Done,The Killers,Hot Fuss,https://i.scdn.co/image/ab67616d000048519c284a6855f4945dc5a3cd73,118,2B,"when there 's nowhere else to run is there room for one more son one more son if you can hold on if you can hold on , hold on i wan na stand up , i wan na let go you know , you know no , you do n't , you do n't i wan na shine on in the hearts of man i want a meaning from the back of my broken hand another head aches , another heart breaks i 'm so much older than i can take and my affection , well , it comes and goes i need direction to perfection , no , no , no , no help me out yeah , you know you got to help me out yeah , oh , do n't you put me on the back burner you know you got to help me out , yeah and when there 's nowhere else to run is there room for one more son these changes ai n't changing me the coldhearted boy i used to be yeah , you know you got to help me out yeah , oh , do n't you put me on the back burner you know you got to help me out , yeah you 're gon na bring yourself down yeah , you 're gon na bring yourself down yeah , you 're gon na bring yourself down i got soul , but i 'm not a soldier i got soul , but i 'm not a soldier i got soul , but i 'm not a soldier i got soul , but i 'm not a soldier i got soul , but i 'm not a soldier i got soul , but i 'm not a soldier i got soul , but i 'm not a soldier i got soul , but i 'm not a soldier i got soul , but i 'm not a soldier i got soul , but i 'm not a soldier time , truth , and hearts yeah , you know you got to help me out yeah , oh , do n't you put me on the back burner you know you got to help me out yeah , you 're gon na bring yourself down yeah , you 're gon na bring yourself down yeah , oh , do n't you put me on the back burner you 're gon na bring yourself down yeah , you 're gon na bring yourself down over and in , last call for sin while everyone 's lost , the battle is won with all these things that i 've done all these things that i 've done time , truth , and hearts if you can hold on if you can hold on"
5,"Andy, You're A Star",The Killers,Hot Fuss,https://i.scdn.co/image/ab67616d000048519c284a6855f4945dc5a3cd73,84,12A,"on the field i remember you were incredible hey , shut up , hey , shut up , yeah on the field i remember you were incredible hey , shut up , hey , shut up , yeah on the match with the boys , you think you 're alone with the pain that you drain from love in a car with a girl , promise me she 's not your world 'cause andy , you 're a star get down leave your number on the locker and i 'll give you a call hey , shut up , hey , shut up , yeah leave your legacy in gold on the plaques that line the hall hey , shut up , hey , shut up , yeah on the streets , such a sweet face jumping in town in the staff room , the verdict is in in a car with a girl , promise me she 's not your world 'cause andy , you 're a star in nobody 's eyes but mine andy , you 're a star in nobody 's eyes but mine andy , you 're a star in nobody 's eyes in nobody 's eyes but mine"
6,On Top,The Killers,Hot Fuss,https://i.scdn.co/image/ab67616d000048519c284a6855f4945dc5a3cd73,127,12A,"remember rio and get down like some other dj , in some other town she 's been trying to tell me to hold tight but i 've been waiting this whole night but i 've been down across a road or two but now i 've found the velvet sun that shines on me and you in the back , ahho , i ca n't crack we 're on top it 's just a shimmy and a shake , ahho i ca n't fake , we 're on top , we 're on top the day is breaking , we 're still here your body 's shaking and it 's clear you really need it , so let go and let me feed it , but you know that i 've been down across a road or two but now i 've found the velvet sun that shines on me and you in the back , ahho , i ca n't crack we 're on top it 's just a shimmy and a shake , ahho i ca n't fake , we 're on top , we 're on top we bring the bump to the grind , ahho i do n't mind , we 're on top it 's just a shimmy and a shake , ahho i ca n't fake , we 're on top , we 're on top and we do n't mean to satisfy tonight so get your eyes off of my pride tonight 'cause i do n't need to satisfy tonight it 's like a cigarette in the mouth or a handshake in the doorway i look at you and smile because i 'm fine and we do n't mean to satisfy tonight so get your eyes off of my pride tonight 'cause i do n't need to satisfy tonight it 's like a cigarette in the mouth or a handshake in the doorway i look at you and smile because i 'm fine now"
7,Glamorous Indie Rock & Roll,The Killers,Hot Fuss,https://i.scdn.co/image/ab67616d000048519c284a6855f4945dc5a3cd73,154,5B,"glamorous indie rock and roll is what i want it 's in my soul , it 's what i need indie rock and roll , it 's time two of us flipping through a thrift store magazine she plays the drums , i 'm on tambourine bet your , your bottom dollar on me it 's indie rock and roll for me it 's indie rock and roll for me it 's all i need it 's indie rock and roll for me in a clutch , i 'm talking every word for all the boys electric girls with worndown toys make it up , break it up , what do you care oh , what do you care i take my twist with a shout a coffee shop with a cause , then i 'll freak you out no sex , no drugs , no life , no love when it comes to today stay if you want to love me , stay oh , do n't be shy , let 's cause a scene like lovers do on silver screens let 's make it , yeah , we 'll cause a scene it 's indie rock and roll for me it 's indie rock and roll for me it 's all i need it 's indie rock and roll for me in a clutch , i 'm talking every word for all the boys it 's indie rock and roll for me it 's all i need make it up , break it up , what do you care it 's indie rock and roll for me two of us flipping through a thrift store magazine indie rock and roll for me it 's all i need make it up , break it up , what do you care it 's indie rock and roll for me"
8,Believe Me Natalie,The Killers,Hot Fuss,https://i.scdn.co/image/ab67616d000048519c284a6855f4945dc5a3cd73,96,8B,"believe me , natalie , listen , natalie this is your last chance to find a gogo dance to disco now please believe me , natalie , listen natalie this is your last chance to find a gogo dance to disco now forget what they said in soho , leave the oh , no '' s out and believe me , natalie , listen natalie this is your last chance there is an old cliche under your monet , baby remember the arch of roses right above your couch forget what they said in soho , leave the oh , no '' s out yes , there is an old cliche under your monet , baby you left the station now to the floor with speculation what was it for in that old hallway , mom says , why do n't you stay you 've been away for a long time '' believe me , natalie this is your last chance to find a gogo forget what they said in soho and walk away if my dreams for us ca n't get you through just one more day it 's alright by me god , help me somehow there 's no time for survival left the time is now 'cause this might be your last chance to disco , ohoh , ohoh"
9,Midnight Show,The Killers,Hot Fuss,https://i.scdn.co/image/ab67616d000048519c284a6855f4945dc5a3cd73,144,2A,"i know what you want i 'm gon na take you to a midnight show tonight if you can keep a secret i got a blanket in the back seat on my mind and a little place that sits beneath the sky she turned her face to speak but noone heard her cry drive faster , boy drive faster , boy , ooh , yeahooh i know there 's a hope there 's too many people trying to help me cope you got a real short skirt i wan na look up , look up , look up , yeah , yeah we were just in time let me take a little more off your mind there 's something in my head , somewhere in the back , saying '' we were just a good thing , we were such a good thing '' make it go away without a word but promise me you 'll stay and fix these things i 've heard oh , make it go away drive faster , boy , ooh , yeahooh oh , no a crashing tide ca n't hide a guilty girl with jealous hearts that start with gloss and curls i took my baby 's breath beneath the chandelier of stars in atmosphere and watched her disappear into the midnight show faster , faster , faster , faster , faster , faster oh no , no , no , no , no , no no , no , no , no , no if you can keep a secret well , baby , i can keep it if you can keep a secret she said she loved me if you can keep a secret , i can keep a secret she said she loved me if you can keep a secret well , baby , i can keep it if you can keep a secret"
10,Everything Will Be Alright,The Killers,Hot Fuss,https://i.scdn.co/image/ab67616d000048519c284a6855f4945dc5a3cd73,128,5A,"doodoo , doodoo i believe in you and me i 'm coming to find you if it takes me all night wrong until you make it right and i wo n't forget you at least i 'll try and run , and run tonight everything will be alright everything will be alright everything will be alright everything will be alright everything will be alright everything will be alright alright , alright , alright , alright i was n't shopping for a doll to say the least , i thought i 'd seen them all but then you took me by surprise i 'm dreaming 'bout those dreamy eyes i never knew , i never knew so take your suitcase , 'cause i do n't mind and baby doll , i meant it every time you do n't need to compromise i 'm dreaming 'bout those dreamy eyes i never knew , i never knew but it 's alright , alright everything will be alright everything will be alright everything will be alright everything will be alright everything will be alright everything will be alright everything will be alright everything will be alright everything will be alright everything will be alright everything will be alright everything will be alright it will be alright"
11,Sam's Town,The Killers,Sam's Town,https://i.scdn.co/image/ab67616d000048514f87f14089217e3f70a5f39e,141,11A,"nobody ever had a dream round here but i do n't really mind that it 's starting to get to me nobody ever pulls the seams round here but i do n't really mind that it 's starting to get to me i 've got this energy beneath my feet like something underground 's going to come up and carry me i 've got this sentimental heart that beats but i do n't really mind that it 's starting to get to me now why do you waste my time is the answer to the question on your mind and i 'm sick of all my judges so scared of what they 'll find but i know that i can make it as long as somebody takes me home every now and then well have you ever seen the lights have you ever seen the lights i took a shuttle on a shock wave ride where people on the pen pull the trigger for accolades i took a bullet and i looked inside running through my veins an american masquerade i still remember grandma dixie 's wake i 've never really known anybody to die before red , white and blue upon a birthday cake my brother , he was born on the fourth of the july and that 's all so why do you waste my time is the answer to the question on your mind and i 'm sick of all my judges so scared of what they 'll find but i know that i can make it as long as somebody takes me home every now and then every now and then every now and then you know i see london , i see sam 's town holds my hand and lets my hair down rolls that world right off my shoulder i see london , i see sam 's town now"
12,When You Were Young,The Killers,Sam's Town,https://i.scdn.co/image/ab67616d000048514f87f14089217e3f70a5f39e,130,1B,you sit there in your heartache waiting on some beautiful boy to to save you from your old ways you play forgiveness watch it now here he comes he does n't look a thing like jesus but he talks like a gentleman like you imagined when you were young can we climb this mountain i do n't know higher now than ever before i know we can make it if we take it slow let 's take it easy easy now watch it go we 're burning down the highway skyline on the back of a hurricane that started turning when you were young when you were young and sometimes you close your eyes and see the place where you used to live when you were young they say the devil 's water it ai n't so sweet you do n't have to drink right now but you can dip your feet every once in a little while you sit there in your heartache waiting on some beautiful boy to to save you from your old ways you play forgiveness watch it now here he comes he does n't look a thing like jesus but he talks like a gentleman like you imagined when you were young talks like a gentleman like you imagined when you were young i said he does n't look a thing like jesus he does n't look a thing like jesus but more than you 'll ever know
13,Bling (Confession Of A King),The Killers,Sam's Town,https://i.scdn.co/image/ab67616d000048514f87f14089217e3f70a5f39e,113,10A,"when i offer you survival you say it 's hard enough to live it 's not so bad , it 's not so bad how do you know that you 're right i awoke on the roadside in the land of the free ride and i ca n't pull it any longer the sun is beating down my neck so i ran with the devil left a trail of excuses like a stone on the water the elements decide my fate watch it go when i offer you survival you say it 's hard enough to live do n't tell me that it 's over , stand up poor and tired , but more than this how do you know that you 're right if you 're not nervous anymore it 's not so bad , it 's not so bad i feel my vision slipping in and out of focus but i 'm pushing on for that horizon i 'm pushing on now i 've got that blowing wind against my face so you sling rocks at the riptide am i wrong or am i right i hit the bottom with a huh , quite strange i get my glory in the desert rain watch it go when i offer you survival when i offer you survival you say it 's hard enough to live and i 'll tell you when it 's over , shut up poor and tired , but more than this how do you know that you 're right if you 're not nervous anymore it 's not so bad , it 's not so bad higher and higher we 're gon na take it down to the wire we 're gon na make it out of the fire higher and higher , higher and higher we 're gon na take it down to the wire we 're gon na make it out of the fire higher and higher , higher and higher we 're gon na take it down to the wire we 're gon na make it out , whoaohoh higher and higher it ai n't hard to hold when it shines like gold you 'll remember me"
14,For Reasons Unknown,The Killers,Sam's Town,https://i.scdn.co/image/ab67616d000048514f87f14089217e3f70a5f39e,140,5B,"i pack my case . i check my face i look a little bit older i look a little bit colder with one deep breath , and one big step , i move a little bit closer i move a little bit closer for reasons unknown i caught my stride i flew and flied i know if destiny 's kind , i 've got the rest of my mind but my heart , it do n't beat , it do n't beat the way it used to and my eyes , they do n't see you no more and my lips , they do n't kiss , they do n't kiss the way they used to , and my eyes do n't recognize you no more for reasons unknown for reasons unknown there was an open chair we sat down in the open chair i said if destiny 's kind , i 've got the rest of my mind but my heart , it do n't beat , it do n't beat the way it used to and my eyes , they do n't see you no more and my lips , they do n't kiss , they do n't kiss the way they used to , and my eyes do n't recognize you at all for reasons unknown for reasons unknown i said my heart , it do n't beat , it do n't beat the way it used to and my eyes do n't recognize you no more and my lips , they do n't kiss , they do n't kiss the way they used to , and my eyes do n't recognize you no more for reasons unknown for reasons unknown for reasons unknown for reasons unknown"
15,Read My Mind,The Killers,Sam's Town,https://i.scdn.co/image/ab67616d000048514f87f14089217e3f70a5f39e,132,3B,"on the corner of main street just trying to keep it in line you say you wan na move on and you say i 'm falling behind can you read my mind can you read my mind i never really gave up on breaking out of this twostar town i got the green light , i got a little fight i 'm gon na turn this thing around can you read my mind oooh can you read my mind oooh the good old days , the honest man the restless heart , the promised land a subtle kiss that no one sees a broken wrist and a big trapeze oh , well , i do n't mind if you do n't mind 'cause i do n't shine if you do n't shine before you go , can you read my mind it 's funny how you just break down waiting on some sign i pull up to the front of your driveway with magic soaking my spine can you read my mind oooh can you read my mind oooh the teenage queen , the loaded gun the drop dead dream , the chosen one a southern drawl , a world unseen a city wall and a trampoline oh , well , i do n't mind , if you do n't mind 'cause i do n't shine if you do n't shine before you jump , tell me what you find when you read my mind slipping in my faith until i fall he never returned that call woman , open the door , do n't let it sting i wan na breathe that fire again she said , i do n't mind , if you do n't mind i do n't mind , if you do n't mind 'cause i do n't shine if you do n't shine '' i do n't shine if you do n't shine put your back on me , put your back on me i do n't mind , if you do n't mind oh , put your back on me oooh the stars are blazing like rebel diamonds cut out of the sun can you read my mind oooh oooh"
16,Uncle Jonny,The Killers,Sam's Town,https://i.scdn.co/image/ab67616d000048514f87f14089217e3f70a5f39e,174,3A,"when everybody else refrained my uncle jonny did cocaine he 's convinced himself right in his brain that it helps to take away the pain hey , jonny hey what you say jonny i wan na go out tonight come a little closer to the city lights levitation ai n't your only friend levitation coming back again you feel a burning in your body 's core it 's a yearning that you ca n't ignore now i wan na go out tonight ssssuperman and hold on tight he 's convinced himself right in his brain that it helps to take away the pain hey , jonny hey what you say jonny my appetite ai n't got no heart i said my appetite ai n't got no heart shocking people when you feel that pull shock 'em , drop 'em when you know it 's full i feel a burning in my body 's core it 's a yearning that you ca n't ignore now i got ta go out tonight hey jonny i got faith in you man , i mean it , it 's gon na be all right he 's convinced himself right in his brain that it helps to take away the pain hey , jonny hey what you say jonny tell us what 's going on feel 's like everything 's wrong hey what you say jonny if the future is real jonny , you 've got to heal hey what you say jonny when everybody else refrained my uncle jonny did cocaine"
17,Bones,The Killers,Sam's Town,https://i.scdn.co/image/ab67616d000048514f87f14089217e3f70a5f39e,140,11B,"come with me we took a back road we 're gon na look at the stars we took a backroad in my car down to the ocean it 's only water and sand and in the ocean we 'll hold hands but i do n't really like you , apologetically dressed in the best , put on a heartbeat glide without an answer , the thunder speaks for the sky , and on the cold wet dirt i cry and on the cold wet dirt i cry do n't you wan na come with me do n't you wan na feel my bones on your bones it 's only natural a cinematic vision ensued like the holiest dream there 's someone calling an angel whispers my name but the message relayed is the same '' wait till tomorrow , you 'll be fine . '' but it 's gone to the dogs in my mind i always hear them when the dead of night comes calling to save me from this fight but they can never wrong this right do n't you wan na come with me do n't you wan na feel my bones on your bones it 's only natural do n't you wan na swim with me do n't you wan na feel my skin on your skin it 's only natural never had a lover i never had a lover never had soul i never had soul never had a good time and i never had a good time never got cold i never got gold do n't you wan na come with me do n't you wan na feel my bones on your bones it 's only natural do n't you wan na swim with me do n't you wan na feel my skin on your skin it 's only natural do n't you wan na come with me do n't you wan na feel my bones on your bones it 's only natural come and take a swim with me . do n't you wan na feel my skin on your skin it 's only natural"
