,title,artist,album,album_image,BPM,Camelot,lyrics
121,Valentine,Inhaler,Cuts & Bruises,https://i.scdn.co/image/ab67616d00004851d2e39ea289f5cdc3a2c1ae13,165,6B,"i got a bone to pick with you but do n't worry , i 'm not mad there 's something great about us , but i should 've took a step back from that fuzzy feeling stuck on the end of your line they say you got a dangerous hook assures me i 'll be fine be my valentine come on , spell it out be my yeah , be my valentine you could never shoot me down we got nothing to do settle into my cage until the wind blows me through ride into your wave i need you on good days and on the bad ones too they say you 're hard to please , but i 'll still give myself to you be my valentine come on , spell it out well , be my be my valentine you can try to shoot me down you could never shoot me down ooh , ooh ooh , ooh be my oh , be my valentine come on , spell it out oh , be my oh , be my valentine do n't let me down you could never shoot me down ooh , ooh ooh , ooh oh , be my yeah , be my valentine and let them try to shoot us down you could never shoot me down"
122,The Things I Do,Inhaler,Cuts & Bruises,https://i.scdn.co/image/ab67616d00004851d2e39ea289f5cdc3a2c1ae13,174,4B,"you ca n't say i lost myself if you do n't know me at all yes , there 's still a bitter taste hiding under my tongue and i 'm just waiting for the night we both get down on our knees how much does forgiveness really count on days like these you say a lot of things and act so wise in spite of all the joy you still terrorise you still need me but it 's just because of you i still do n't know why i do the things why i do the things i do i still do n't know why i do the things you say it 's meaningless to look the other way i 'm begging for a hand to get me out of this place because i 'll take this armageddon to the grave so can we fix this love of ours it 's getting late i ca n't see straight you say a lot of things and act so wise in spite of all the joy you still terrorise you still need me but it 's just because of you i still do n't know why i do the things why i do the things i do i still do n't know why i do the things you say a lot of things and act so wise in spite of all the joy you still terrorise you still need me you still need me you still need me but it 's just because of you i still do n't know why i do the things i do the things i do i still do n't know it 's just because of you i still do n't know why i do the things why i do the things i do i still do n't why i do the things why i do the things i do i do , i do do the things i do i still do n't know why i do these things"
123,Now You Got Me,Inhaler,Cuts & Bruises,https://i.scdn.co/image/ab67616d00004851d2e39ea289f5cdc3a2c1ae13,112,5A,"you felt like a kid when you heard that sound for the first time like a song at the back of your head it was your little secret now you got me wherever you want me do i want you to say it back because we ca n't stay let 's run away , oh now you got me where you want me 'cause you know now you got me where you want me it 's just about seven o'clock now you got me where you want me ahahah i just want to let you know take me down to the place by the beach where we dreamed our days away say the word and i 'll be there love wo n't tear us apart i do n't know what i would do nothing could drag me away , away from you where you can drown your fear and i 'll be there for the taking now you got me where you want me 'cause you know now you got me where you want me , oh it 's just about seven o'clock now you got me where you want me ahahah i just want to let you know i 'll go with you yeah , anywhere when lightning strikes i 'm hypnotised yeah , say it 'cause now you got me where you want me 'cause you know now you got me where you want me , oh it 's just about seven o'clock now you got me where you want me ahahah i just want to let you know which is nowhere i 'd be nowhere i 'd be nowhere nowhere"
124,Open Wide,Inhaler,Open Wide,https://i.scdn.co/image/ab67616d00004851cef2111200e1ef69a320d81e,120,8B,"messed up in bed dreams held us higher we swore that nothing could come and free us when it 's too hard to stretch out over wire the need for silence slowly killing you i do n't need these ties as much as i need freedom from you you got your arms out open wide you say come on baby , take a look i 'll stay with you when you are cruel to the violent thoughts in your head but sometimes you 'll do much worse you ca n't reverse the beautiful things you said yeah , in blue jeans , the faded color 'cause we wear them always yeah , we trampled on holy ground so you could throw your toys out of the crib and i 'll hold down these ties as much as i want freedom from you you got your arms out open wide you say come on baby , take a look '' i 'll stay with you when you are cruel to the violent thoughts in your head sometimes you 'll do much worse you ca n't reverse the beautiful things you said yeah love is a terror , when they stick together love is a terror if it 's all forever love is a terror got my arms out open wide got my arms out open wide yeah , arms out open wide come on baby take a look inside i 'll stay with you when you are cruel to the violent thoughts in your head but sometimes you 'll do much worse you ca n't reverse the beautiful things you said got my arms out open wide you got your arms out open wide your arms out open wide your arms out open wide"
125,Your House,Inhaler,Open Wide,https://i.scdn.co/image/ab67616d00004851cef2111200e1ef69a320d81e,122,10A,"right around six or something there i was barefoot in the street where i thought i 'd float through your door and i 'd ... i 'd been there before but i ai n't so oh love i 'm going nowhere you wo n't find me maybe i sold love for what it 's worth on the street said oh love there ai n't a sharp enough knife to cut me out of your life i 'm going to your house tonight and there 's gold in the sky in the city we tried shining east of your face thought you 'd aim at her gates though there 's nothing to say but i 'm ... oh love i 'm going nowhere you wo n't find me maybe i sold love for what it 's worth on the street said oh love there ai n't a sharp enough knife to cut me out of your life who 's going to your house tonight i 'm leaving everything to you so save me the trouble as you 're sliding into view save me the trouble oh love i 'm going nowhere you wo n't find me maybe i sold love for what it 's worth on the street said oh love there ai n't a sharp enough knife to cut me out of your life who 's going to your house tonight who 's going to your house tonight tonight , tonight , tonight who 's going to your house tonight tonight , tonight , tonight"
126,Chloe Kelly,Surf Curse,Buds,https://i.scdn.co/image/ab67616d00004851e7289c3e83beb4d0c1084c97,98,10B,i tried so hard to stay the same but it 's so hard when you 're trying to change i 'm getting tired of your face cause all this shit is rotting my brain you do n't listen to anything i say you do n't listen to anything i say anyways i feel so sick when i think of you if i see you again it 'll be too soon i tried to remember you from the start but now your using using my heart you do n't listen to anything i say you do n't listen to anything i say anyways
127,Bummer Friend,Surf Curse,Buds,https://i.scdn.co/image/ab67616d00004851e7289c3e83beb4d0c1084c97,95,12B,nobody like the things we do we always come off as so rude but i ca n't hang with you dudes you really mess up my mood oh bummer friends i really ca n't stand you guys even though i try and try but i do n't even hav to lie i 'll be with you till i die oh bummer friends your such a bummer man your such a bummer friend
128,Heathers,Surf Curse,Buds,https://i.scdn.co/image/ab67616d00004851e7289c3e83beb4d0c1084c97,176,6B,you should call me tonight while you are sleeping so i can talk to all of you dreams and they 'll tell me what to do when i 'm alone with you cause i really do not understand what the fuck is wrong with you i 've been crazy for this boy i really like his gun i think he 's kind of crazy but i 've got nowhere to run cause he tells me what to do and he wants me to kill you and i really think i might because heather i hate you
129,Ponyboy,Surf Curse,Buds,https://i.scdn.co/image/ab67616d00004851e7289c3e83beb4d0c1084c97,169,1B,lets go out we 're still young we can take my car we 're leaving soon we can go to our homes kill our parents hit the road you promised me everything was gon na be alright 4x take these pills lets get drunk at the cemetery it sounds like fun we can dance on the graves till our bodies melt away you promised me everything was gon na be alright 8x
130,In My Head Till I'm Dead,Surf Curse,Buds,https://i.scdn.co/image/ab67616d00004851e7289c3e83beb4d0c1084c97,191,12B,"why do i waste all my time thinking of you i 'd rather die your eyes are always in my mind it keeps me awake every night 'cause you 're in my head , in my head , ooh you 're in my head , in my head , ooh you 're in my head , in my head , ooh you 're in my head , in my head , ooh yeah , ooh yeah , ooh yeah , ooh i 've never felt so much pain if i close my eyes i see your face when i 'm alone i scream your name my lolita , i 'm not insane but you 're in my head , in my head , ooh you 're in my head , in my head , ooh you 're in my head , in my head , ooh you 're in my head , in my head , ooh yeah , ooh yeah , ooh yeah , ooh yeah , ooh"
131,The Smell Saved My Life,Surf Curse,Buds,https://i.scdn.co/image/ab67616d00004851e7289c3e83beb4d0c1084c97,189,9B,"woooooooooo oooo i see the smell now i 'm ready for hell if this is the end , then i guess it 's the end because my california dream it came true x2 it came true x5 i see the smell now i 'm ready for hell if this is the end , then i guess it 's the end because my california dream it came true x2 it came true x5 woooooooooooooooo x2"
132,Goth Babe,Surf Curse,Buds,https://i.scdn.co/image/ab67616d00004851e7289c3e83beb4d0c1084c97,100,12B,i want a goth babe in my life i want someone i can bite i want to listen to the cure i want to tell you that i 'm yours we can shoegaze in my room so we can sing about our gloom i want to feel you in my soul if you feel the way i do if you feel the way i do i want a goth babe in my head a girl dressed in black in red to do a seance in my bed and then we 'll fuck till we 're both dead candle wax dropped on my nips while we worship robert smith i want to feel you in my soul if you feel the way i do if you feel the way i do
133,Dreamin' Wild,Surf Curse,Buds,https://i.scdn.co/image/ab67616d00004851e7289c3e83beb4d0c1084c97,190,6B,i 've been trying to write a hit record sleepless long nights thinking bout whatever i 've been trying to hang in forever dreamin ' wild wishing someone will hear all my songs maybe someday i 'll fall in love then i 'll know they have somewhere to belong dreamin ' wild
134,Fire Walk With Me,Surf Curse,Buds,https://i.scdn.co/image/ab67616d00004851e7289c3e83beb4d0c1084c97,161,11B,"fire walk away with me , tonight , tonight i wrote in my diary that i 'm fine , that i 'm fine let 's hang out by the train tracks , tonight , tonight split that golden heart with me , i 'll be your guy , your guy fire walk with me , fire walk with me fire walk with me , fire walk with me let 's get drunk in my room , it 's red , it 's red there is something in my room , in my head , in my head laura palmer , where she been she 's dead , she 's dead some one tell her father , she 's dead , she 's dead fire walk with me , fire walk with me fire walk with me , fire walk with me"
135,Christine F,Surf Curse,Nothing Yet,https://i.scdn.co/image/ab67616d00004851d3e4b261f19dcab165f5aca5,91,9B,"killing my time , killing myself , killing my friends oh man , i 'd do it again i said i 'm killing my time , killing myself , killing my friends oh man , i 'd do it again i said i 'm killing my time , killing myself , killing my friends oh man , i 'd do it again i said i 'm killing my time , killing myself , killing my friends oh man , i 'd do it again i said i 'm losing my mind , losing my self , losing my head oh man , i 'm losing again i said i 'm losing my mind , losing my self , losing my head oh man , i 'm losing again i said i 'm killing my time , killing myself , killing my friends oh man , i 'd do it again i said i 'm killing my time , killing myself , killing my friends oh man , i 'd do it again i said i 'm losing my mind , losing my self , losing my head oh man , i 'm losing again i said i 'm losing my mind , losing my self , losing my head oh man , i 'm losing again i said i 'm killing my time , killing myself , killing my friends oh man , i 'd do it again i said i 'm killing my time , killing myself , killing my friends oh man , i 'd do it again i said i 'm losing my mind , losing my self , losing my head oh man , i 'm losing again i said i 'm losing my mind , losing my self , losing my head oh man , i 'm losing again i said i 'm killing my time , killing myself , killing my friends oh man , i 'd do it again i said i 'm killing my time , killing myself , killing my friends oh man , i 'd do it again i said i 'm losing my mind , losing my self , losing my head oh man , i 'm losing again i said i 'm losing my mind , losing my self , losing my head oh man , i 'm losing again i said i 'm killing my time , killing myself , killing my friends oh man , i 'd do it again i said i 'm killing my time , killing myself , killing my friends oh man , i 'd do it again"
136,Doom Generation,Surf Curse,Nothing Yet,https://i.scdn.co/image/ab67616d00004851d3e4b261f19dcab165f5aca5,182,4B,i fell in love with jimmy i saw him on tv i did n't really want to but everybody made me bleed for me bleed for me bleed for me bleed for me i heard it from jimmy the end is so soon for a generation of living a generation of doom bleed for me bleed for me bleed for me bleed for me
137,The Strange and the Kind,Surf Curse,Nothing Yet,https://i.scdn.co/image/ab67616d00004851d3e4b261f19dcab165f5aca5,174,9B,oh i wish we had a little more time because days are just days for the rest of our lives and if you leave they will leave you behind and if you stay they will stay on your mind cause i thought that i 'd know everything by this time but i 'll be dazed and confused all my life oh i wish we could stay out all night let the wind cool our hair as we drive through the years of the strange and the kind through the change that never came when we liked cause i thought that i 'd know everything but this time but i 'll be dazed and confused oh i 'll be dazed and confused all my life
138,It Followed Me,Surf Curse,Nothing Yet,https://i.scdn.co/image/ab67616d00004851d3e4b261f19dcab165f5aca5,174,11B,i do n't want you to talk cause i know you 'll talk for days i 've been running through my thoughts and i almost got away but it followed me but it followed me and i 've been here for days and i hope that i wo n't change until it swallows me i do n't want you to walk cause i know you 'll walk away it 's been harder than i thought and the feelings oh so strange and i 've been here for days and the feeling never fades it just follows me it just follows me
139,Cronenberg,Surf Curse,Nothing Yet,https://i.scdn.co/image/ab67616d00004851d3e4b261f19dcab165f5aca5,189,4B,i wish i could see you i wish we could talk i wish i could be you i wish we could love cutting me open cutting me off off of your body out of your blood cause you 're in my flesh cause you 're in my flesh cause you 're in my flesh cause you 're in my flesh i think i 'm crazy i think its the times i wish you could save me i wish you could hide under my skin my eyes into your womb out of your mind cause you 're in my flesh cause you 're in my flesh cause you 're in my flesh cause you 're in my flesh you 're in oh you 're in oh you 're in so
140,Sleeping,Surf Curse,Nothing Yet,https://i.scdn.co/image/ab67616d00004851d3e4b261f19dcab165f5aca5,116,10B,are you sleeping through the summer are you sleeping through the summer cause i wan na be your lover cause i wan na be your lover are you sleeping through the summer are you sleeping through the summer cause i wan na be your lover cause i wan na be your lover just ca n't wait to sleep again just ca n't wait to sleep again wake up next to my best friend wake up next to my best friend just ca n't wait to sleep again just ca n't wait to sleep again wake up next to my best friend wake up next to my best friend but when i 'm awake you 're not there are you sleeping are you sleeping are you sleeping are you sleeping
141,Nostalgia,Surf Curse,Nothing Yet,https://i.scdn.co/image/ab67616d00004851d3e4b261f19dcab165f5aca5,161,1B,i 'm not with you anymore but i still dream about it you 're the tumor in my head and i ca n't live without it cause i remember when i remember all i can yes i remember when and i 'm trying to forget you we 're not 18 anymore but we 've still got our habits you 're the creature in my heart and you 're about to devour it cause i remember when i remember all i can yes i remember when and i 'm trying to forget you
142,All Is Lost,Surf Curse,Nothing Yet,https://i.scdn.co/image/ab67616d00004851d3e4b261f19dcab165f5aca5,187,5B,stay i want you to stay even when you ca n't help me be okay i want you to stay 'cause i want you again 'cause i want you again 'cause i want you again 'cause i want you again hurt me where you are hurt me when you say i do n't know who you are i do n't know what to say 'cause i lost you again 'cause i lost you again 'cause i lost you again 'cause i lost you again 'cause i lost you again 'cause i lost you again 'cause i lost you again 'cause i lost you again 'cause i lost you again 'cause i lost you again 'cause i lost you again 'cause i lost you again 'cause i lost you again 'cause i lost you again
143,Falling Apart,Surf Curse,Nothing Yet,https://i.scdn.co/image/ab67616d00004851d3e4b261f19dcab165f5aca5,173,8B,there 's blood in my heart but none in the rest of me i 'm feeling my bones they 're getting the best of me i 'm losing myself due to a lack of sleep i 'll never quite be what people expect of me i 'm falling apart i 've fallen too far i 'm falling apart i 've fallen too far there 's blood in my throat enough to choke on it i 'm feeling controlled by something i ca n't resist i 'm so tired maybe i 'll just give in maybe i 'll just give in maybe i 'll just give in i 'm falling apart i 've fallen too far i 'm falling apart i 've fallen too far
144,Maps to The Stars,Surf Curse,Heaven Surrounds You,https://i.scdn.co/image/ab67616d0000485106267ca3bd711fa73860889f,180,12B,hey are you gon na find me look on the maps to the stars oh my heart is on fire burn whoever you are hey are you gon na find me look on the maps to the stars oh my heart is on fire burn whoever you are
145,Labyrinth,Surf Curse,Heaven Surrounds You,https://i.scdn.co/image/ab67616d0000485106267ca3bd711fa73860889f,170,10A,i am alive and all my fears they have become excessive pride turned into excessive love outside i will wait for you to know i 'll try while i wait for you to know outside i will wait for you to know i 'll try while i wait for you to know i am dead and i never said that you were wrong in the labyrinth i never knew where i should run outside where i wait for you to know i 'll try while i wait for you to know outside i will wait for you to know i 'll try while i wait for you to know
146,River's Edge,Surf Curse,Heaven Surrounds You,https://i.scdn.co/image/ab67616d0000485106267ca3bd711fa73860889f,129,11B,i do n't recognize myself maybe it 's for the better i 've always felt like someone else and maybe i 'd feel better living on the rivers edge where nothing is ever said and all the people never forget all the things you never said i hope i can still write songs when my memories are all gone i hope i can hear you sing when i 'm sick of everything living on the rivers edge where nothing is ever said and all the people never forget all the things you never said
147,Midnight Cowboy,Surf Curse,Heaven Surrounds You,https://i.scdn.co/image/ab67616d0000485106267ca3bd711fa73860889f,175,11B,"hope i do n't wake you tonight but the boy knows when the money 's tight walking around under neon lights find me a lover if the money 's right i 've been living like a midnight cowboy showing it off to the cruisers eyes i 've been living like a midnight cowboy dreaming of days of a different life some of them i meet at the bars and some of them want me in their cars when they take me i close my eyes imagine you living the desert life i 've been living like a midnight cowboy showing it off to the cruisers eyes i 've been living like a midnight cowboy dreaming of days of a different life i 've been , oh i 've been i 've been living like a midnight cowboy i 've been , oh i 've been i 've been living like a midnight cowboy i 've been , oh i 've been i 've been living like a midnight cowboy i 've been , oh i 've been i 've been living like a midnight cowboy i 've been , oh i 've been i 've been living like a midnight cowboy"
148,Hour of the Wolf,Surf Curse,Heaven Surrounds You,https://i.scdn.co/image/ab67616d0000485106267ca3bd711fa73860889f,107,10B,beware of the bleeding moon cause i 'm still missing you all day in every way beware of the witching hour cause i can feel you in my room is that still you beware of the buried child he runs oh so wild and free he 's just like me but i ca n't touch your skin it burns with the shitty grin of zeus and heaven surrounds you beware of the bleeding moon cause i 'm still missing you all day in every way
149,Dead Ringers,Surf Curse,Heaven Surrounds You,https://i.scdn.co/image/ab67616d0000485106267ca3bd711fa73860889f,188,10A,if you find that instrument the one made of gold you can use it on my chest find my mutated soul even when i 'm not with you i do n't feel alone and i can feel that pain wherever you may go
150,Safe,Surf Curse,Heaven Surrounds You,https://i.scdn.co/image/ab67616d0000485106267ca3bd711fa73860889f,160,11B,there goes my name there goes my way i 'm feeling so cold i 'm feeling so safe i held you today i held you away i feel so alone i 'm safer alone here we go there goes my face all of the ways it twisted and maimed when i tore it away i 'm ugly today in so many ways i ca n't leave my home i 'm safer at home here we go i 'm safe alone i 'm safe alone i 'm safe alone i 'm safe alone i 'm safe alone
151,Memory,Surf Curse,Heaven Surrounds You,https://i.scdn.co/image/ab67616d0000485106267ca3bd711fa73860889f,167,10B,loose lips told me all your secrets runnin your fingers thru my hair and you whispered all your serious thoughts to see if i 'd follow them along it 's just a distant memory that 's always gon na follow me remember when we went to tahoe lake in the summer the water was n't tamed and we sang every pavement song we could and your malkmus was just so damn good
152,Opera,Surf Curse,Heaven Surrounds You,https://i.scdn.co/image/ab67616d0000485106267ca3bd711fa73860889f,204,4B,i 'll see you on the stage tonight breaking hearts and changing lives you were always good at changing mine at the opera house in the pale blue light cause i know it hurts to close your eyes so i 'd rather you just watch me die and i know you must be terrified just stare into my dying eyes this time i wonder if he 'll come tonight tie my wrists and fuck my mind cause it 's getting late and i 'm oh so tired of the games we play with each other 's lives cause it hurts so much to close my eyes but i never wan na watch you die and i 'd rather make myself go blind then stare into your dying eyes so i 'll close mine
153,Trust,Surf Curse,Heaven Surrounds You,https://i.scdn.co/image/ab67616d0000485106267ca3bd711fa73860889f,176,7A,beyond me questions seep and i ca n't breath so lean on my go go go wo n't you please slow slow slow enough for me with your trust so clean baby take a chance on me i ca n't sleep lovers leave when i ca n't breath just lean on me come come come come to me so so so afraid of things and she said to me baby take a chance on me
154,Jamie,Surf Curse,Heaven Surrounds You,https://i.scdn.co/image/ab67616d0000485106267ca3bd711fa73860889f,106,12B,"another night of feeling lonely and confused then i get the call from jamie saying hey boo boo we need to have some we need a good time we need this in our lives it 's all from the wild one i 'm never gon na deny it was meant to be like this all of your friends really make thinks clear we hit the bar and any place with a dance floor we sing our songs and let our memories unfold watching a smile so honest , so lovely and hopeful thanking my lucky stars for giving me people to live for it was meant to be like this all of your friends really make thinks clear i love all the people in my life all my friends keep me alive"
155,Arrow,Surf Curse,Magic Hour,https://i.scdn.co/image/ab67616d000048515f0175d327129ccbab084614,159,9B,i 've been talking to myself but i do n't know what to say guess i never had the chance to get the words right anyway there 's a shadow on my smile leave a light on for the pain speak it when i lose myself write it down when i give it away i 've been trying to love myself shoot an arrow in my brain hit the floor and i 'm bleeding out guess i should work on my aim lost in time and angel 's breath i get dizzy from the flame getting high on eagle death bitter honor for the shame lost in time and angel 's breath i get dizzy from the flame getting high on eagle death bitter honor for the shame there 's a shadow on my smile leave a light on for the pain scream it when i lose myself bitter honor for the shame
