,title,artist,album,album_image,BPM,Camelot,lyrics
395,Nabokov,Fontaines D.C.,Skinty Fia,https://i.scdn.co/image/ab67616d00004851b23737878e75582c2e255029,94,9A,"i did you a favor i bled myself dry well , this is what it is now pain , pain he 's selling insurance selling clouds to the sky you sold me on living living is nothing but you 're so good lookin ' i bled myself dry daze ya phase ya happy days , yeah daze ya phase ya happy days , yeah i did you a favor phase ya i bled myself dry happy days , yeah well , this is what it is now daze ya pain , pure sky phase ya happy days , yeah i 'll be your dog of submission daze ya my mission phase ya to help you forget happy days , yeah i 'll be your dog in the corner daze ya phase ya i will light your cigarette happy days , yeah but you 're so good lookin ' daze ya phase ya happy days , yeah but you 're so good lookin ' daze ya phase ya happy days , yeah ah , i did you a favor daze ya phase ya happy days , yeah i did you a favor daze ya phase ya happy days , yeah ah , i did you a favor daze ya phase ya i bled myself out happy days , yeah well , this is what it is now daze ya phase ya pain , pure sky happy days , yeah i 'll be your dog in the corner daze ya phase ya happy days , yeah i will be your dog daze ya in the corner phase ya happy days , yeah daze ya phase ya happy days , yeah daze ya phase ya happy days , yeah daze ya phase ya happy days , yeah daze ya phase ya happy days , yeah daze ya phase ya happy days , yeah daze ya phase ya happy days , yeah daze ya phase ya"
396,Romance,Fontaines D.C.,Romance,https://i.scdn.co/image/ab67616d00004851613f62075c85e0b853318026,138,7B,into the darkness again in with the pigs in the pen god knows i love ye screws in my head i will be beside you till you 're dead deep in the night i confide that maybe my goodness has died i pray for your kindness heart on a spit and maybe romance is a place yeah maybe romance is a place yeah maybe romance is a place for me and you and you and
397,Starburster,Fontaines D.C.,Romance,https://i.scdn.co/image/ab67616d00004851613f62075c85e0b853318026,98,6B,"it may feel bad it may feel bad it may feel bad i wan na see you alone , i wan na sharp the stone i wan na bounce the bone , i wan na mess with it i wan na lay the deville , the whole crew on the sill i want the preacher and pill , i wan na bless with it i wan na head to a mass and get cast in it that shit 's funnier than any aclass , in ' it i wan na talk with the clown who has apologies down pay him 300 pound to take a class in it i wan na bite the phone , i wan na bleed the tone i wan na see you alone , alone , alone , 'lone i wan na strait the shark and find me somewhere to park like the light when it 's dark , it 's dark , it 's dark , dark a few stars about make it feel like peace in a way a complimentary round constellation got a twist in it for a gpo and all the hits in it i 'm gon ' hit your business if it 's momentary blissness i 'm gon ' hit your business if it 's momentary blissness i 'm gon ' hit your business if it 's momentary blissness i 'm gon ' hit your business if it 's momentary i wan na talk with a gag if it 's a bottle or bag i wan na strike with the sag , i need the friends fro it i wan na shot the dark , i wan na make the mark i want to live the arc , i call the ends on it i wan na take the truth without a lens on it my god given insanity , it depends on it how i feel how i feel how i feel i wan na keel over harder than a turned up challenger i wan na keep all your charm in a canister do you inspire like the same did salinger i 'm the pig on the chinese calendar i got a shadow like a .58 caliber i wan na move like a new salamander i love the carrion who 's a real scavenger it 's moral tyranny keeping it from me hit me for the day for the light that you suffered to come by take to my sky never wanting only wonder to live out of reach sloping family short to tall one to three swallow the key in their footprints i will follow i 'm gon ' hit your business if it 's momentary blissness i 'm gon ' hit your business if it 's momentary blissness i 'm gon ' hit your business if it 's momentary blissness i 'm gon ' hit your business if it 's momentary blissness"
398,Here's The Thing,Fontaines D.C.,Romance,https://i.scdn.co/image/ab67616d00004851613f62075c85e0b853318026,123,9A,"so here 's the thing i know you 're watching i feel your pain it 's mine as well i know you 're right i know you 're right , girl and if you change your mind i will be waiting i know your thoughts they 're mine as well i know you 're right i know you 're right , girl shockin ' pretty is that face you 're makin ' is there a sentiment you 'd like to tell but if you tell them what the real story is i 'm afraid it would n't play that well oh no so here 's the thing i need commotion i know your thoughts they 're mine as well i know you 're right i know you 're right , girl and if you change your mind i will be waiting to keep your pain with mine as well i know you 're right i know you 're right , girl are n't people made to chime it never makes me happy anymore always singing in my mind and talking just provokes it , ah so here 's the thing i know you 're watching i feel your pain it 's mine as well i know you 're right i know you 're right , girl to be anaesthetised and crave emotion so beautiful to hurt so well i know you 're right i know you 're right , girl so here 's the thing i know you 're watching"
399,Desire,Fontaines D.C.,Romance,https://i.scdn.co/image/ab67616d00004851613f62075c85e0b853318026,80,8A,deep they 've designed you from cradle to pyre in the mortal attire desire desire it 's so hard to find you the mist you 've acquired has you turned to a liar desire desire desire desire i see them driving into nothing where the nothing is sure they drown their wishes in the fountain like their fathers before all they want denied and in the park the firefighters turned their bodies to glass some people seemed to take their time when they pass deep they 've designed you from cradle to pyre in the mortal attire desire desire it 's high to be wanted but haunted is higher and the change requires desire desire desire desire desire every 24 wretchin ' with desire all 24 wretchin ' with with desire every 24 wretchin ' with desire all 24 wretchin ' with with desire every 24 wretchin ' with desire all 24 wretchin ' with with desire all 24 wretchin ' with with desire all 24 wretchin ' with with desire
400,In The Modern World,Fontaines D.C.,Romance,https://i.scdn.co/image/ab67616d00004851613f62075c85e0b853318026,118,4A,"i feel alive in the city that you like and wait for the day to go dreaming right by oh oh oh oh seems so hard not to be free when you walk right beside me in the modern world what in the modern world i do n't feel anything in the modern world i do n't feel bad , charlene kissing on the corner yeah wait for just a minute what come away with me and sal i promise you 'll be in it i do n't feel bad i feel alive in the city you despise and wait for the day when you come riding on by oh oh oh oh seems so hard just to be if it matters you complete me , yeah in the modern world what in the modern world i do n't feel anything in the modern world i do n't feel bad , charlene kissing on the corner yeah wait for just a minute what come away with me and sal i promise you 'll be in it i do n't feel bad in the modern world what in the modern world i do n't feel ... no , i do n't feel i do n't feel bad as long as i 've known as long as i 've known as long as i 've known there 's no feeling to draw you may be the reason but i am the law the law as long as i 've known there 's no feeling to draw you may be the reason but i am the law the law ... i feel alive in the city that you like in the modern world what in the modern world i do n't feel anything in the modern world i do n't feel bad , charlene kissing on the corner yeah wait for just a minute what come away with me and sal i promise you 'll be in it so do n't feel bad in the modern world what in the modern world i do n't feel no i do n't feel as long as i 've known i do n't feel bad as long as i 've known charlene as long as i 've known yeah there 's no feeling to draw what you may be the reason but i am the law i do n't feel bad"
401,Bug,Fontaines D.C.,Romance,https://i.scdn.co/image/ab67616d00004851613f62075c85e0b853318026,131,9A,"changed my name to promise you '' , yeah dying inside 'cause i want to , yeah did n't i say i wanted to , yeah honey , i 'd changed before you , yeah twentyeight years are coming to end the rain chased me down the gully again now i 'm higher than anyone here and dirt ai n't nothing on me , yeah bbb , baby , i swear it , i wanted to call but on my way round , i happened to fall she 's a mua at carnegie hall in her vanity mirror , we 're losing it all well we shacked up swift abandonment way catch the sweet rain inside a beret i 'm in it , i 'm reflecting all of the day and i will fade in the night , yeah will you apologise for the remainder of your life do you accept the charges i promise you i 'll promise to , yeah well now she curls up with his favourite son he 's the ugliest man in heaven for one as long as there 's nobody fooling me there then dirt ai n't nothing on me , yeah , yeah they threw me out like i was a wedding bouquet now i ca n't quite remember what i had to say till i get higher than everyone here and i will fade in the night , yeah in the charmless morning i promise to be gone i almost felt the feeling that i wanted to , i wanted to , yeah , ah you thought i was here but i am farther than the sun , the sun ah , silent as the feeling that i 've promised you , i promise you , yeah well , i changed my name to promise you '' , yeah it 's easier than making apologies , yeah now i 'm higher than anyone , yeah and dirt ai n't nothing on me , yeah"
402,Motorcycle Boy,Fontaines D.C.,Romance,https://i.scdn.co/image/ab67616d00004851613f62075c85e0b853318026,88,2A,"dreams , they got me choking i 'm joking in mine people sick with feeling they never align all the life i 've shown ye will own ye in time it 's fine i know you rain , i snow you stay , i go motorcycle boy motorcycle boy motorcycle boy motorcycle boy motorcycle boy motorcycle boy motorcycle boy motorcycle boy sinner shows emotion provokes them to hang people stood in silence when they tied him , they sang drowned him in the crowd swells our church bells , they rang no one wants a madness they start to understand it 's fine i know you rain , i snow you stay , i go motorcycle boy motorcycle boy motorcycle boy motorcycle boy motorcycle boy motorcycle boy motorcycle boy motorcycle boy motorcycle boy motorcycle boy motorcycle it 's fine i know you rain , i snow you stay , i go"
403,Sundowner,Fontaines D.C.,Romance,https://i.scdn.co/image/ab67616d00004851613f62075c85e0b853318026,150,5B,"in my dreams i ca n't help it in my dreams seen it coming in my dreams i ca n't help it in my dreams turns to nothing a sadness in the soul i dreamed it long ago but i have not belonged to any setting sun a destination low and i 'd hate to see ye go now that i can feel it it 's faster if i call ye in my dreams i just wan na hear you call i ca n't help it waiting for a while in my dreams you know i 'm not cynical seen it coming i give into a smile in my dreams well , i just wan na feel it i ca n't help it waiting for a while in my dreams wish that i could feel it turns to nothing yeah so you who will contend with things until they end will sleep another off and try to start again fascination lines down all your face and eyes and say you 'll never feel it it 's faster if i call ye in my dreams i just wan na hear you call i ca n't help it been waiting for a while in my dreams you know i 'm not cynical seen it coming i give into a smile in my dreams well , i just wan na feel it i ca n't help it waiting for a while in my dreams i wish that i could feel it turns to nothing in my dreams in my dreams in my dreams in my dreams"
404,Horseness Is The Whatness,Fontaines D.C.,Romance,https://i.scdn.co/image/ab67616d00004851613f62075c85e0b853318026,118,2B,basics understanding basics you 'll never let your guard down and always leave a card out but always the word is not so friendly it brings some fucking baggage it 's a word that 's used for lying and never never i would trust it sticks around for some while always stays for none will someone find out what the word is that makes the world go 'round 'cause i thought it was love but some say that it has to be choice i read it in some book or an old packet of smokes basics i guess i get the gist there 's not that much to miss you choose or you exist
405,Death Kink,Fontaines D.C.,Romance,https://i.scdn.co/image/ab67616d00004851613f62075c85e0b853318026,99,8B,"when you came into my life , i was lost and you took that shine to me at what cost you recognised the smell human pain said , i 'd learn to love the chain '' it was shit , shit , shit battered i caved in my promise was shattered amazing stats from the dreaming i made a promise and i killed it shit , shit , shit , shit battered i live meretricious you shattered amazing stars from the drink i made a promise when you said i taste like sleep i was dead when will you step in the room out of your head you said that i was bad that was fine when you said i could be good , i would n't have it there 's a certain kind of air in the smoke must be some amount of truth in the joke for it to make them laugh hahaha and teary faces know the craft shit , shit , shit battered i caved in , my promise was clattered amazing stars from the drink i made a promise and i killed it shit , shit , shit , shit battered a whole life meretricious you shattered amazing stars from my dreamin ' i made a promise and i killed it shit , shit , shit battered i caved in , my promise was clattered amazing stars from the drink i made a promise"
406,Favourite,Fontaines D.C.,Romance,https://i.scdn.co/image/ab67616d00004851613f62075c85e0b853318026,76,12A,"did you know i can claim the dreamer from the dream make you feel everything you 've never even seen yeah , it 's been a long , a long , a long , a long , a long , long you 've been my favourite for a long time stitch and fall the faces rearranged you will see beauty give the way to something strange yeah , it 's been a long , a long , a long , a long , a long , long you 've been my favourite for a long time well , look who 's just the newest clown thirtyfive hours coming down how the sun shines on new pavement and you do n't even feel it it 's a cry far from bed radios and days spent playing football indoors when they painted town with thatcher they never even wanted to know ya feel alone i can slip the sunshine to the day yeah stick your heart to everything you say yeah to be gone , be gone , be gone , be gone , be gone you 've been my favourite for a long time you 've been my favourite for a long time favourite for a long time favourite for a long time favourite for a long time all the pieces last forever all the pieces last forever all the pieces daradaradaradaradara all the pieces darada , darada did you know cities on return are often strange yeah , and now every time you blink , you feel it change and it 's been a long , a long , a long , a long , long , long you 've been my favourite for a while ahh , it makes sense when you understand the misery made me another marked man and i 'm always looking over my shoulder and each new day , i get another year older shoulder bound to the frame of a door chewed into shape like a stone on the shore but if there was lightning in me you 'd know who it was for did you know i can claim the dreamer from the dream make you feel everything you 've never even seen yeah , it 's been a long , a long , a long , a long , a long , long you 've been my favourite for a long time you 've been my favourite for a long time you 've been my favourite for a long time you 've been my favourite for a long time"
407,Seaside,The Kooks,Inside In / Inside Out,https://i.scdn.co/image/ab67616d0000485163a28c5ecb7b13e9b329fe47,129,3A,"do you want to go to the seaside i 'm not trying to say that everybody wants to go i fell in love at the seaside i handled my charm with time and sleight of hand do you want to go to the seaside i 'm not trying to say that everybody wants to go i fell in love at the seaside she handled her charm with time and sleight of hand , and oh but i 'm just trying to love you any kind of way but i find it hard to love you , girl , when you 're far away away do you want to go to the seaside i 'm not trying to say that everybody wants to go but i found love on the seaside on the seaside , in the seaside"
408,See The World,The Kooks,Inside In / Inside Out,https://i.scdn.co/image/ab67616d0000485163a28c5ecb7b13e9b329fe47,161,9B,"do you want to see the world do you want to see the world do you want to see the world in a different way yeah do you want to see the world do you want to see the world do you want to see the world in a different way i remember how we used to sing writing poems in your bed sit finding time to be the passenger but there you were , you never saw me leave but there you go , you 're sailing away and you know you never come away yeah , but you should , you never lie to me yeah , but i will , you never come away yeah , but you should what do you really want to see what do you really want to see what do you really want see on your television screen i remember how we used to be without the world upon our tv well , let it lie or you can take it back or wrap your life around evil 's track but there you go , you 're sailing away but there you go and you know you never come away yeah , but you should , you never lie to me yeah , but i will , you never come away yeah , but you should well , do you want to see the world what , what do you want to see the world what , what well , do you want to see the what , what , what well do you want to see the world what , what , what well , do you want to see the world what , what , what i know i do yeah , do you want to see the world what , what , what i know i do well , do you really want to what , what i know i do well , do you really want to what , what i know i do well , do you really want to see i know i do , i know i do , i know i do"
409,Sofa Song,The Kooks,Inside In / Inside Out,https://i.scdn.co/image/ab67616d0000485163a28c5ecb7b13e9b329fe47,80,12A,"well , city freeze for i just realised i do n't like you me and my girl are going out for some air and i will do my best just to get under her dress and catch you out if i can on the other side of my sofa wo n't you come on over the other side of my sofa oh , wo n't you come on over the city heated up it got blurry cause i 'd had enough and he tried to take your soul but did n't realise you keep it in a different hole wo n't you come on over the other side of my sofa oh , wo n't you come on over so here he comes , a man with a loaded gun i do n't know if he wants my soul or my cash flow i suppose i do n't know so here he comes , a man with a loaded gun i do n't know if he wants my girl 's heart or her pearls , oh i suppose i do n't know i suppose i do n't know i suppose i do n't know i suppose i do n't know i suppose i do n't know i suppose i do n't know"
410,Eddie's Gun,The Kooks,Inside In / Inside Out,https://i.scdn.co/image/ab67616d0000485163a28c5ecb7b13e9b329fe47,168,11B,"did you see the way she looked at me honey bee 's got two lives and she 's got me i tried to love her back and then i shrunk back into my wrap and in the barrel of my gun i hope i 'm not the only one yes , i see the way she looked at me oh , she 's got an eye for an awkward guy like me i tried to love her back she 's just a girl and then i shrunk back into my wrap she 's just a girl and in the barrel of my gun i hope i 'm not the only one and in the barrel of my gun i hope i 'm not the only one yeah dodododo , dododo , dodo i tried to love her back she 's just a girl and then i shrunk back into my wrap she 's just a girl and in the barrel of my gun i hope i 'm not the only one and in the barrel of my gun i hope i 'm not the only one yeah do , do , do , do , do i tried to love her back and then i shrunk back in my wrap and then i tried to love i tried to love her back"
411,Ooh La,The Kooks,Inside In / Inside Out,https://i.scdn.co/image/ab67616d0000485163a28c5ecb7b13e9b329fe47,151,3A,"in their eyes is a place that you finally discovered that you love it here , you 've got to stay on the bottom of the rock , an island on which you find you love it when you twitch you feel that itch in you pettycoat your pretty pretty pettycoat then you smiled , he got wild you did n't understand that there 's money to be made beauty is a card that must get played by organisation and ooh la , she was such a good girl to me and ooh la , the world just chewed her up and spat her out and ooh la , she was such a good girl to me and ooh la , the world just chewed her up and spat her out the world can be a very big place so be yourself do n't get out of place love your man and love him twice go to hollywood and pay the price oh go to hollywood and do n't be a star , it 's such a drag take care of yourself , do n't begin to lag it 's a hard life to live , so live it well i 'll be your friend and not in pretend i know you girl in all situations and ooh la , she was such a good girl to me and ooh la , the world just chewed her up and spat her out and ooh la , she was such a good girl to me and ooh la , the world just chewed her up and spat her out pretty pretty pretty pretty pretty pretty pretty pretty pretty pretty pretty pettycoat pretty pretty pretty pretty pretty pretty pretty pretty pretty pretty pretty pretty pretty pretty pretty pretty pettycoat in all situations and ooh la , she was such a good girl to me and ooh la , the world just chewed her up and spat her out and ooh la , she was such a good girl to me and ooh la , the world just chewed her up and spat her out"
412,You Don't Love Me,The Kooks,Inside In / Inside Out,https://i.scdn.co/image/ab67616d0000485163a28c5ecb7b13e9b329fe47,167,10A,"but you do n't love me the way that , i love you 'cause if you did girl you would not , do those things you do you killed my heart just to see if , i will rise above your anger and above your lies and all i see of you , is when you 're not so busy oh your not so busy and you do n't love me the way that , i love you 'cause if you did girl you would not , do the things you do you turned my life around , before that i am glad however much i love you this love is getting bad and oh my darling look at you the words that only you could use but you know you 'll always be my girl , girl i 'll take you out just for a bite show you all the city sites but you know you 'll always be my girl , girl but you do n't love me the way that , i love you 'cause if you did girl you would not , do those things you do you killed my heart just to see if , i will rise above your anger and above your lies and all i see of you , is when you 're not so busy oh your not so busy but you do n't love me you do n't care , woman and you do n't love me you do n't care , woman 'cause you do n't love me you do n't care , woman if you do n't love me you do n't care , woman oh woman"
413,She Moves In Her Own Way,The Kooks,Inside In / Inside Out,https://i.scdn.co/image/ab67616d0000485163a28c5ecb7b13e9b329fe47,153,9B,"so at my show on monday , i was hoping someday you 'd be on your way to better things it 's not about your makeup or how you try to shape up to these tiresome paper dreams paper dreams , honey so now you pour your heart out , you 're telling me you 're far out but not about to lie down for your cause but you do n't pull my strings 'cause i 'm a better man moving on to better things well , uhoh , oh , i love her because she moves in her own way well , uhoh , oh , she came to my show just to hear about my day and at the show on tuesday , she was in her mind , see tempered furs and spangled boots looks are deceiving , make me believe it and these tiresome paper dreams paper dreams , honey , yeah so wo n't you go far , tell them you 're a keeper not about to lie down for your cause and you do n't pull my strings 'cause i 'm a better man moving on to better things well , uhoh , oh , i love her because she moves in her own way well , uhoh , oh , she came to my show just to hear about my day yes , i wish that we never made it there through all the summers and kept them up instead of kicking us back down to the suburbs yes , i wish that we never made it there through all the summers and kept them up instead of kicking us back down to the suburbs but uhoh , i love her because she moves in her own way but uhoh , she came to my show just to hear about my day but uhoh , oh , i love her because she moves in her own way but uhoh , oh , she came to my show just to hear about my day"
